<?xml version="1.0" encoding="utf-8"?><POResponseAndAmendment xmlns:xsi="http://www.w3.org/2001/XMLSchema-instance" xmlns:xsd="http://www.w3.org/2001/XMLSchema" xsi:noNamespaceSchemaLocation="POResponseAndAmendmentv1_0.xsd"><POResponsePurpose>PO Confirmation</POResponsePurpose><PONumber>0123456798</PONumber><POVersionNumber>0</POVersionNumber><POResponseVersionNumber>0</POResponseVersionNumber><messageGenerationDateTime>2019-01-21T12:01:46.1279305+08:00</messageGenerationDateTime><latestUpdateDateTime>2019-01-21T12:01:46.1279305+08:00</latestUpdateDateTime><headerRemarks>Check markings on cases, there was a problem with past orders. This is general information only, not to be processed by your system.</headerRemarks><sender><senderName>T1ABC</senderName><senderPerson>Sam Jones</senderPerson></sender><recipient>T2ABCD</recipient><buyer><buyerName>T1 Supplier Company Limited</buyerName><buyerAddressLine1>48/F, Kodak House, 123 Java Road, North Point</buyerAddressLine1><buyerAddressLine2>address line 2</buyerAddressLine2><buyerAddressLine3>address line 3</buyerAddressLine3><buyerAddressLine4>address line 4</buyerAddressLine4><buyerCity>Hong Kong</buyerCity><buyerProvince>Guangdong</buyerProvince><buyerCountryCode>HK</buyerCountryCode><buyerPostalCode>000</buyerPostalCode><buyerContactPerson>Mr John Smith</buyerContactPerson><buyerContactTelNumber>852 1234 5678</buyerContactTelNumber><buyerContactEmail>j.smith@email.com</buyerContactEmail></buyer><sellerName>T2 Supplier Company Limited</sellerName><POLineItem><lineItemNumber>1</lineItemNumber><requestDate>2018-07-01</requestDate><lineRemarks>Supply of material to be as per samples approved on 2017-12-14</lineRemarks><materialReferenceNumber>3432545532</materialReferenceNumber><confirmedDeliveryDate>2019-01-17</confirmedDeliveryDate><confirmedDeliveryQty>100.000</confirmedDeliveryQty></POLineItem></POResponseAndAmendment>